34.01592,-118.49814,"Santa Monica Parking Structure 2 - 1235 2nd St"
33.95435,-118.38591,"LAX cell phone waiting area"
34.05464,-118.25546,"Los Angeles Marriott Downtown","333 S Figueroa St","90071"
34.13423,-118.34998,"Universal Studios limo waiting area"
34.10161,-118.32951,"Approach to Graumann's Chinese Theatre from east","Hollywood & N Cahuenga Blvd"
34.12059,-118.30022,"Griffith Park Observatory Parking Lot Near Observatory"
34.07048,-117.95836,"I 10 Eb San Bernardino Fwy E, Baldwin Park, USA"
